
╔══════════════════════════════════════════════════════════════════════════════╗
║ LA FAVELA GAME - SESSION DE DEBUG AAA                                       ║
╠══════════════════════════════════════════════════════════════════════════════╣
║ Session ID: 20260131_192218_1022                                            ║
║ Démarré le: 2026-01-31 19:22:18                                             ║
║ Godot: 4.5.1-stable (official)                                              ║
║ OS: Windows                                                                 ║
╚═══════════════════════════════════════════════════════════════════════════════

[31/01 19:22:18.618] [TRACE] [LogSystem] 📋 Synchronisation log Godot activée: C:/Users/niko9/AppData/Roaming/Godot/app_userdata/LaFavelaGame/logs/godot.log
[31/01 19:22:18.621] [INFO] [LogSystem] === SESSION DE LOG AAA DÉMARRÉE ===
[31/01 19:22:18.621] [INFO] [LogSystem] ID Session: 20260131_192218_1022
[31/01 19:22:18.621] [INFO] [LogSystem] Chemin: C:/Users/niko9/Documents/LaFavelaGame/logs/game_logs.txt
[31/01 19:22:18.621] [INFO] [LogSystem] Godot: 4.5.1-stable (official)
[31/01 19:22:18.621] [INFO] [LogSystem] OS: Windows
[31/01 19:22:18.621] [DEBUG] [LogSystem] Mémoire au démarrage: 179.02 MB
[31/01 19:22:18.621] [INFO] [NodeGroupCache] Systeme de cache de groupes initialise
[31/01 19:22:18.827] [DEBUG] [VoiceChat] 🎤 [Peer:1] [INIT] === VOICE CHAT MANAGER READY ===
[31/01 19:22:18.827] [DEBUG] [VoiceChat] 🎤 [Peer:1] [INIT] Mode: PTT, Distance max: 10.0m
[31/01 19:22:18.027] [INFO] [Weather] Système météo initialisé - PARTLY_CLOUDY, 20.0°C
[31/01 19:22:18.028] [INFO] [Achievements] Steam détecté - synchronisation activée
[31/01 19:22:18.028] [INFO] [Achievements] Système initialisé - 0/22 débloqués
[31/01 19:22:18.028] [INFO] [Accessibility] Contraste élevé: false
[31/01 19:22:18.028] [INFO] [Accessibility] Échelle UI: 100%
[31/01 19:22:18.028] [INFO] [Accessibility] Audio mono: false
[31/01 19:22:18.029] [INFO] [Accessibility] Sensibilité caméra: 1.00
[31/01 19:22:18.029] [INFO] [Accessibility] Inversion Y: false
[31/01 19:22:18.029] [INFO] [Accessibility] Système d'accessibilité initialisé
[31/01 19:22:23.152] [INFO] [Godot] NodeHelper ready - Fonctions de recherche centralisees
[31/01 19:22:23.153] [INFO] [Godot] ✓ UIFactory ready - Composants UI centralisés
[31/01 19:22:23.153] [INFO] [Godot] MultiplayerHelper ready - Fonctions multijoueur centralisees
[31/01 19:22:23.153] [INFO] [Resource] 🗂️ ResourceCache initialisé (avec support async)
[31/01 19:22:23.153] [INFO] [Godot] 🎮 Performance Overlay: Press F3 to toggle
[31/01 19:22:23.153] [INFO] [Godot] [Statistics] Statistiques initialisees - Mode session (stats fraiches)
[31/01 19:22:23.153] [INFO] [Godot] === INVENTORY SYSTEM (CLOTHING-BASED) INITIALIZED ===
[31/01 19:22:23.153] [INFO] [Godot] ✓ Structure d'inventaire créée: 8 slots (4 vêtements + 4 poches)
[31/01 19:22:23.153] [INFO] [Godot] ✓ Inventaire chargé depuis Global (0 items)
[31/01 19:22:23.154] [INFO] [Godot] ️ TimeSystem ready: time_string=06:00, date_string=04/07/2024
[31/01 19:22:23.154] [INFO] [Godot] 🌅 Connecté à TimeSystem - Heure: 06:00 - Phase: dawn
[31/01 19:22:23.154] [INFO] [Godot] 🌅 GlobalDayNightCycle initialisé (AAA Quality)
[31/01 19:22:23.154] [INFO] [Godot] === EVENT SYSTEM INITIALIZED ===
[31/01 19:22:23.154] [INFO] [Godot] === PNJ CACHE SYSTEM INITIALIZED ===
[31/01 19:22:23.154] [INFO] [Godot] ℹ️ No cache file found, starting fresh
[31/01 19:22:23.154] [INFO] [Godot] === CLUE SYSTEM INITIALIZED ===
[31/01 19:22:23.154] [INFO] [Godot] ℹ️ No clues file found
[31/01 19:22:23.154] [INFO] [Godot] [SkillSystem] Systeme de competences initialise
[31/01 19:22:23.154] [INFO] [Godot] [SkillSystem] 12 competences chargees
[31/01 19:22:23.154] [INFO] [Godot] [SkillSystem] Donnees chargees: 0 competences
[31/01 19:22:23.154] [INFO] [Godot] AdressesDatabase: Eden City system ready - 23 districts, 45 streets
[31/01 19:22:23.154] [INFO] [Godot] 🎨 CharacterCustomizer: 82 textures preloadées (cache vidé)
[31/01 19:22:23.154] [INFO] [Godot] === CITIZEN DATABASE INITIALIZED ===
[31/01 19:22:23.154] [INFO] [Godot] [VictimeSystem] Système de victimes initialisé (spawn manuel uniquement)
[31/01 19:22:23.154] [INFO] [Godot]   ✓ Animation chargée: idle (depuis Root|Idle)
[31/01 19:22:23.154] [INFO] [Godot]     🔧 Root motion supprimé: run
[31/01 19:22:23.154] [INFO] [Godot]   ✓ Animation chargée: run (depuis Root|Run)
[31/01 19:22:23.154] [INFO] [Godot]   ✓ Animation chargée: jump (depuis Root|Jump)
[31/01 19:22:23.154] [INFO] [Godot]   ✓ Animation chargée: Typing (depuis mixamo_com)
[31/01 19:22:23.154] [INFO] [Godot]     🔧 Root motion supprimé: Walking
[31/01 19:22:23.154] [INFO] [Godot]   ✓ Animation chargée: Walking (depuis mixamo_com)
[31/01 19:22:23.154] [INFO] [Godot]   ✓ Animation chargée: Dying (depuis mixamo_com)
[31/01 19:22:23.154] [INFO] [Godot]   ✓ Animation chargée: Death From Right (depuis mixamo_com)
[31/01 19:22:23.154] [INFO] [Godot]   ✓ Animation chargée: DeathFromTheFront (depuis mixamo_com)
[31/01 19:22:23.154] [INFO] [Godot]   ✓ Animation chargée: InjuredIdle (depuis mixamo_com)
[31/01 19:22:23.154] [INFO] [Godot]     🔧 Root motion supprimé: InjuredWalkjambe
[31/01 19:22:23.154] [INFO] [Godot]   ✓ Animation chargée: InjuredWalkjambe (depuis mixamo_com)
[31/01 19:22:23.154] [INFO] [Godot]     🔧 Root motion supprimé: InjuredWalkingbras
[31/01 19:22:23.154] [INFO] [Godot]   ✓ Animation chargée: InjuredWalkingbras (depuis mixamo_com)
[31/01 19:22:23.154] [INFO] [Godot]     🔧 Root motion supprimé: InjuredRunjambe
[31/01 19:22:23.154] [INFO] [Godot]   ✓ Animation chargée: InjuredRunjambe (depuis mixamo_com)
[31/01 19:22:23.154] [INFO] [Godot]   ✓ Animation chargée: Injured Hurting Idle (depuis mixamo_com)
[31/01 19:22:23.154] [INFO] [Godot]   ✓ Animation chargée: SittingMale (depuis mixamo_com)
[31/01 19:22:23.154] [INFO] [Godot]   ✓ Animation chargée: SittingFemale (depuis mixamo_com)
[31/01 19:22:23.154] [INFO] [Godot]  PNJPool ready (call initialize_async() to pre-populate)
[31/01 19:22:23.154] [INFO] [Godot]   ✓ DialogueUI
[31/01 19:22:23.154] [INFO] [Godot]   ✓ DoorContextMenu
[31/01 19:22:23.154] [INFO] [Godot]   ✓ PNJContextMenu
[31/01 19:22:23.154] [INFO] [Godot]   ✓ BedContextMenu
[31/01 19:22:23.154] [INFO] [Godot]   ✓ DateDisplayUI (hidden by default)
[31/01 19:22:23.154] [INFO] [Godot]   ✓ EvidenceContextMenu
[31/01 19:22:23.154] [INFO] [Godot]   ✓ InvestigationProgressUI
[31/01 19:22:23.154] [INFO] [Godot]   ✓ GameModeIndicator (hidden by default)
[31/01 19:22:23.154] [INFO] [Godot] ✅ UIManager initialisé - Tous les UIs prêts
[31/01 19:22:23.154] [INFO] [Godot]   + EconomyDashboardUI initialise (Touche L)
[31/01 19:22:23.154] [INFO] [Godot] ============================================================
[31/01 19:22:23.154] [INFO] [Godot] [MULTIPLAYER] Protocol Version: 1.1.0
[31/01 19:22:23.154] [INFO] [Godot] [MULTIPLAYER] Features: base64_position, steam_p2p_voice, bandwidth_optimizer, name_sanitize
[31/01 19:22:23.154] [INFO] [Godot] ============================================================
[31/01 19:22:23.154] [INFO] [Godot] 🚀 [AAA] BandwidthOptimizer activé (-70% bandwidth sur positions)
[31/01 19:22:23.154] [INFO] [Godot] [COMBAT] Module initialisé
[31/01 19:22:23.154] [INFO] [Godot] [EQUIPMENT] Module initialisé
[31/01 19:22:23.155] [INFO] [Godot] [FURNITURE] Module initialisé
[31/01 19:22:23.155] [INFO] [Godot] [APARTMENT] Module initialisé
[31/01 19:22:23.155] [INFO] [Godot] [MINIGAME] Module initialisé
[31/01 19:22:23.155] [INFO] [Godot] [PHONE] Module initialisé
[31/01 19:22:23.155] [INFO] [Godot] [NPC] Module initialisé
[31/01 19:22:23.155] [INFO] [Godot] [WORLD] Module initialisé
[31/01 19:22:23.155] [INFO] [Godot] [💬 ChatSync] Module initialisé
[31/01 19:22:23.155] [INFO] [Godot] [TickRate] Preset applied: MEDIUM
[31/01 19:22:23.155] [INFO] [Physics] [TickRate] Physics: 60 Hz, Network: 20 Hz, Validation: 10 Hz
[31/01 19:22:23.155] [INFO] [Godot] ✅ [AAA FIX BUG001] RemotePlayers container PERSISTANT créé dans MultiplayerManager
[31/01 19:22:23.155] [INFO] [Godot] ✅ Steam Lobbies initialisé
[31/01 19:22:23.155] [INFO] [Godot] ✅ ApproachDialogueSystem: Templates chargés (4 catégories)
[31/01 19:22:23.155] [INFO] [Godot] ✅ ApproachDialogueSystem: Templates contextuels chargés (7 catégories)
[31/01 19:22:23.155] [INFO] [Godot] [DossierManager] Système de dossiers initialisé
[31/01 19:22:23.155] [INFO] [Godot] [QuestSystem] Systeme de quetes initialise
[31/01 19:22:23.155] [INFO] [Godot] [QuestSystem] 0 templates de quetes charges
[31/01 19:22:23.155] [INFO] [Godot] [QuestSystem] Donnees chargees: 1 actives, 0 completees
[31/01 19:22:23.155] [INFO] [Godot] 📱 PhoneManager initialisé (Multiplayer)
[31/01 19:22:23.155] [INFO] [Godot] 📱 0 téléphones chargés
[31/01 19:22:23.155] [INFO] [Godot] 📱 Signaux multiplayer connectés
[31/01 19:22:23.155] [INFO] [Godot]   Bus 'Microphone' créé avec AudioEffectCapture
[31/01 19:22:23.155] [INFO] [Godot]   Bus 'VoiceChat' créé
[31/01 19:22:23.155] [INFO] [Godot]   Microphone configuré
[31/01 19:22:23.155] [INFO] [Godot]   Signaux PhoneManager connectés pour vocal
[31/01 19:22:23.155] [INFO] [Godot]   Action 'voice_chat' (touche V) enregistrée
[31/01 19:22:23.155] [INFO] [Godot]   VoiceIndicatorUI créée
[31/01 19:22:23.155] [INFO] [Godot] 🎤 [Peer:1] [INIT] === VOICE CHAT MANAGER READY ===
[31/01 19:22:23.155] [INFO] [Godot] 🎤 [Peer:1] [INIT] Mode: PTT, Distance max: 10.0m
[31/01 19:22:23.155] [INFO] [Godot] 🧹 CleaningService initialisé
[31/01 19:22:23.155] [INFO] [Godot] 💋 EscortService initialisé
[31/01 19:22:23.155] [INFO] [Godot] === POLICE SERVICE INITIALISÉ (v5.0 - Architecture Modulaire AAA) ===
[31/01 19:22:23.155] [INFO] [Godot]   Numéro d'urgence: 911 / 17
[31/01 19:22:23.155] [INFO] [Godot]   Escalade: INFINIE (1 mort = 2 renforts)
[31/01 19:22:23.155] [INFO] [Godot] [PoliceDialogueManager] Dialogues chargés (4 contextes)
[31/01 19:22:23.155] [INFO] [Godot]   ✓ Modules AAA initialisés (Dialogue, Spawning, Confrontation)
[31/01 19:22:23.155] [INFO] [Godot]   ✅ Dialogues police chargés (4 contextes)
[31/01 19:22:23.155] [INFO] [Godot]   ✅ Signaux multiplayer connectés
[31/01 19:22:23.155] [INFO] [Godot] ApartmentVariationSystem: Initialized with 8 themes
[31/01 19:22:23.155] [INFO] [Godot] [FurnitureCatalog] Catalogue initialisé avec 59 items
[31/01 19:22:23.155] [INFO] [Godot] [ApartmentRentSystem] Initialisé - 0 contrats actifs
[31/01 19:22:23.155] [INFO] [Godot] [ApartmentCustomization] Initialisé - 15 papiers peints, 10 sols disponibles
[31/01 19:22:23.155] [INFO] [Godot] [FloorStateManager] Système de gestion par étage AAA initialisé
[31/01 19:22:23.155] [INFO] [Godot] [FurniturePlacementValidator] Système de validation AAA initialisé
[31/01 19:22:23.155] [INFO] [Godot] [ApartmentValueSystem] Système de valeur dynamique AAA initialisé
[31/01 19:22:23.155] [INFO] [Godot] === CRIME SCENE SYSTEM INITIALISÉ ===
[31/01 19:22:23.156] [INFO] [Godot] ✓ Scène de crime préchargée: CrimeSceneApartment
[31/01 19:22:23.156] [INFO] [Godot] === TIMELINE SYSTEM INITIALISÉ ===
[31/01 19:22:23.156] [INFO] [Godot] === CRIME SCENE TRIGGER PRÊT ===
[31/01 19:22:23.156] [INFO] [Godot] Touches de debug:
[31/01 19:22:23.156] [INFO] [Godot]   F5 - Changer thème variation (suivant)
[31/01 19:22:23.156] [INFO] [Godot]   F6 - Appliquer variation aléatoire
[31/01 19:22:23.156] [INFO] [Godot]   F7 - Afficher thèmes disponibles
[31/01 19:22:23.156] [INFO] [Godot]   F9 - Générer un meurtre
[31/01 19:22:23.156] [INFO] [Godot]   F10 - Générer un vol
[31/01 19:22:23.156] [INFO] [Godot]   F11 - Ouvrir l'UI d'investigation
[31/01 19:22:23.156] [INFO] [Godot]   F12 - Téléporter à la scène de crime
[31/01 19:22:23.156] [INFO] [Godot] ✓ CrimeSceneSystem trouvé
[31/01 19:22:23.156] [INFO] [Godot] ✓ ApartmentVariationSystem trouvé (8 thèmes)
[31/01 19:22:23.156] [INFO] [Godot]  LanguageManager initialisé - Langue: fr
[31/01 19:22:23.156] [INFO] [Godot] [CaseAssignmentSystem] Système d'assignation initialisé
[31/01 19:22:23.156] [INFO] [Godot] [GameLoopManager] Systeme de boucle de jeu initialise
[31/01 19:22:23.156] [INFO] [Godot] [GameLoopManager] Donnees chargees: phase=0, cas actifs=0
[31/01 19:22:23.156] [INFO] [Godot] [BriefingSystem] Systeme de briefing initialise
[31/01 19:22:23.156] [INFO] [Godot] [DebriefingSystem] Systeme de debriefing initialise
[31/01 19:22:23.156] [INFO] [Godot] [TutorialManager] Systeme de tutoriel initialise
[31/01 19:22:23.156] [INFO] [Godot] [TutorialManager] Donnees chargees: 0 tutoriels completes
[31/01 19:22:23.156] [INFO] [Godot] [TutorialTracker] Systeme de tracking tutoriel initialise
[31/01 19:22:23.156] [INFO] [Godot] [InvestigationResolver] Systeme de resolution initialise
[31/01 19:22:23.156] [INFO] [Godot] [DialogueConsequenceSystem] Systeme de consequences initialise
[31/01 19:22:23.156] [INFO] [Godot] [DialogueConsequenceSystem] Donnees chargees
[31/01 19:22:23.156] [INFO] [Godot] ╔══════════════════════════════════════════════════════════════╗
[31/01 19:22:23.156] [INFO] [Godot] ║        LA FAVELA - GANG SYSTEM MANAGER v2.0                  ║
[31/01 19:22:23.156] [INFO] [Godot] ║              AUTO-INITIALIZATION MODE                        ║
[31/01 19:22:23.156] [INFO] [Godot] ╚═══════════════════════════════════════════════════════════════
[31/01 19:22:23.156] [INFO] [Godot] [NarrativeFramework] Framework narratif initialise
[31/01 19:22:23.156] [INFO] [Godot] [NarrativeFramework] Donnees chargees - Chapitre: premiers_pas
[31/01 19:22:23.156] [INFO] [Godot] [ChapterNotification] Connecte a NarrativeFramework
[31/01 19:22:23.156] [INFO] [Godot] [ChapterNotification] Systeme de notifications initialise
[31/01 19:22:23.156] [INFO] [Godot] [InputRemapper] Bindings charges
[31/01 19:22:23.156] [INFO] [Godot] [InputRemapper] Systeme de remappage initialise
[31/01 19:22:23.156] [INFO] [Godot] [ReputationSystem] Systeme de reputation initialise (6 factions)
[31/01 19:22:23.156] [INFO] [Godot] [PhotoSystem] Systeme photo initialise (0 photos)
[31/01 19:22:23.156] [INFO] [Godot] [FlashbackSystem] Systeme de flashbacks initialise (3 flashbacks)
[31/01 19:22:23.156] [INFO] [Godot] [PlayerNotesSystem] Carnet d'investigation initialise (5 notes) - Input DÉSACTIVÉ par défaut
[31/01 19:22:23.156] [INFO] [Godot] === JOB SYSTEM INITIALIZED ===
[31/01 19:22:23.156] [INFO] [Godot] UIAnimations ready - Animations UI standardisees
[31/01 19:22:23.156] [INFO] [Godot] ✅ Discord connecté!
[31/01 19:22:23.156] [INFO] [Godot] 🎮 Discord Rich Presence initialisé
[31/01 19:22:23.156] [INFO] [Godot] === DEALER SYSTEM INITIALIZED ===
[31/01 19:22:23.156] [INFO] [Godot]  Nouveau heist disponible: Épicerie
[31/01 19:22:23.156] [INFO] [Godot]  Nouveau heist disponible: Station essence
[31/01 19:22:23.156] [INFO] [Godot] === HEIST SYSTEM INITIALIZED ===
[31/01 19:22:23.156] [INFO] [Godot] === GANG AFFILIATION SYSTEM INITIALIZED ===
[31/01 19:22:23.156] [INFO] [Godot] MapOverlaySystem initialise (M pour ouvrir)
[31/01 19:22:23.156] [INFO] [Godot] StrategicMapManager: Initializing...
[31/01 19:22:23.156] [INFO] [Godot] StrategicMapManager: Ready with 4 subsystems
[31/01 19:22:23.156] [INFO] [Godot] RealEstateUIManager: Connected to BuildingSystemManager
[31/01 19:22:23.156] [INFO] [Godot] RealEstateUIManager: Connected to ApartmentVariationSystem
[31/01 19:22:23.157] [INFO] [Godot] RealEstateUIManager: Initialized (H pour ouvrir Dynasty 8 Real Estate)
[31/01 19:22:23.157] [INFO] [Godot] [FinanceManager] Initialized - Debts: 0, Investments: 0
[31/01 19:22:23.157] [INFO] [Godot] [BusinessManager] Initialized - Drugs: 0 types, Dealers: 0, Spots: 0
[31/01 19:22:23.157] [INFO] [Godot] [VehicleManager] Initialized - Vehicles: 0/2
[31/01 19:22:23.157] [INFO] [Godot] [CareerManager] Initialized - Criminal career:  (Rank 0)
[31/01 19:22:23.157] [INFO] [Godot] [PlayerLifeManager v2.0.0] Initialized
[31/01 19:22:23.157] [INFO] [Godot]   - Net Worth: $0.00
[31/01 19:22:23.157] [INFO] [Godot]   - Milestones: 0/19
[31/01 19:22:23.157] [INFO] [Godot]   - Financial Health: FAIR
[31/01 19:22:23.157] [INFO] [Godot] 📦 DroppedItemsManager initialisé
[31/01 19:22:23.157] [INFO] [Godot] 💬 [ChatboxManager] Historique chargé
[31/01 19:22:23.157] [INFO] [Godot] 💬 [ChatboxManager] Initialisé avec 6 canaux
[31/01 19:22:23.157] [INFO] [Godot] 👑 [VIPRegistry] Systeme VIP initialise
[31/01 19:22:23.157] [INFO] [Godot] 👑 [VIPSpawnManager] Initialise
[31/01 19:22:23.157] [INFO] [Godot] ️ [HeadquartersManager] Initialise avec 9 QG
[31/01 19:22:23.157] [INFO] [Godot] DamageSystem ready
[31/01 19:22:23.157] [INFO] [Godot] 🩸 BloodEffects ready (pool: 20 decals)
[31/01 19:22:23.157] [INFO] [Godot] WantedSystem ready
[31/01 19:22:23.157] [INFO] [Godot] AmmoSystem ready (rechargement 3 etapes)
[31/01 19:22:23.157] [INFO] [Godot]   🔊 Sons charges: mag_out=true, mag_insert=true, chamber=true, empty=true, holster=true
[31/01 19:22:23.157] [INFO] [Godot]   🔫 Sons shotgun: pump=true, shell_load=true
[31/01 19:22:23.157] [INFO] [Godot] IntimidationSystem ready
[31/01 19:22:23.157] [INFO] [Godot] NPCReactionSystem ready
[31/01 19:22:23.157] [INFO] [Godot] === APARTMENT MANAGER INITIALISÉ ===
[31/01 19:22:23.157] [INFO] [Godot] ✓ Scène appartement préchargée
[31/01 19:22:23.157] [INFO] [Resource] 🔊 Son d'urination chargé: res://systems/assets/audio/pisseU.ogg
[31/01 19:22:23.157] [INFO] [Godot] EmbeddedBulletSystem ready
[31/01 19:22:23.157] [INFO] [Godot] 📋 Paramètres Drawing par défaut
[31/01 19:22:23.157] [INFO] [Godot] 🎨 DrawingSettings initialisé
[31/01 19:22:23.157] [INFO] [Godot] 📋 Paramètres Petit Bac par défaut
[31/01 19:22:23.157] [INFO] [Godot]  PetitBacSettings initialisé
[31/01 19:22:23.157] [INFO] [Godot]  PetitBacMenuManager initialisé
[31/01 19:22:23.157] [INFO] [Godot] ✅ CodenamesSettings chargé - 711 mots disponibles
[31/01 19:22:23.157] [INFO] [Godot] ✅ CodenamesMenuManager initialisé
[31/01 19:22:23.157] [INFO] [Godot] ✅ QuiplashSettings chargé - 99 prompts disponibles
[31/01 19:22:23.157] [INFO] [Godot] ✅ QuiplashMenuManager initialisé
[31/01 19:22:23.157] [INFO] [Godot] PacmanMenuManager ready
[31/01 19:22:23.157] [INFO] [Godot] === HI-FI MANAGER PRÊT (PERSISTANT) ===
[31/01 19:22:23.157] [INFO] [Godot]   Albums trouvés: 2
[31/01 19:22:23.157] [INFO] [Godot] [CardTextureLoader] Initialisé
[31/01 19:22:23.157] [INFO] [Godot] [CardSounds] Initialisé avec 28 types de sons
[31/01 19:22:23.157] [INFO] [Godot] 🎮 Steam Rich Presence: Au menu principal
[31/01 19:22:23.157] [INFO] [Godot] 💬 Discord Rich Presence: Au menu principal
[31/01 19:22:23.157] [INFO] [Godot] [MenuPrincipal] Slideshow configure: 4 images, intervalle 10.0s
[31/01 19:22:23.157] [INFO] [Godot] [MenuPrincipal] Connection des signaux... (has_saves=true)
[31/01 19:22:23.157] [INFO] [Godot]   ✓ button_play connecté
[31/01 19:22:23.157] [INFO] [Godot]   ✓ button_load connecté (disabled=false)
[31/01 19:22:23.157] [INFO] [Godot]   ✓ button_join_friend connecté
[31/01 19:22:23.157] [INFO] [Godot]   ✓ button_options connecté
[31/01 19:22:23.157] [INFO] [Godot]   ✓ button_quit connecté
[31/01 19:22:23.157] [INFO] [Godot]   ✓ Signal connection_success connecté pour Steam
[31/01 19:22:23.157] [INFO] [Godot]   ✓ Signal connection_failed connecté
[31/01 19:22:23.157] [INFO] [Godot]   ✓ Signal lobby_join_failed connecté
[31/01 19:22:23.157] [INFO] [Godot]   ✓ Signal lobby_creation_failed connecté
[31/01 19:22:23.157] [INFO] [Godot]   ✓ Signal p2p_connection_timeout connecté
[31/01 19:22:23.157] [INFO] [Godot] ✓ Traits du joueur initialisés
[31/01 19:22:23.157] [INFO] [Godot] InvestigationProgressUI initialise
[31/01 19:22:23.157] [INFO] [Godot] 📱 Pas de téléphone existant à broadcaster
[31/01 19:22:23.157] [INFO] [Godot] 🎤 VoiceIndicatorUI connecté au VoiceChatManager
[31/01 19:22:23.157] [INFO] [Godot] [HousingSystemHub] Initialisé - Systèmes connectés:
[31/01 19:22:23.157] [INFO] [Godot]   - BuildingSystemManager: ✓
[31/01 19:22:23.157] [INFO] [Godot]   - AddressRegistry: ✓
[31/01 19:22:23.158] [INFO] [Godot]   - ApartmentStateManager: ✓
[31/01 19:22:23.158] [INFO] [Godot]   - NPCHousingSystem: ✓
[31/01 19:22:23.158] [INFO] [Godot]   - ApartmentRentSystem: ✓
[31/01 19:22:23.158] [INFO] [Godot]   - FurnitureCatalog: ✓
[31/01 19:22:23.158] [INFO] [Godot]   - RealEstateUI: ✓
[31/01 19:22:23.158] [INFO] [Godot]   - FloorStateManager: ✓
[31/01 19:22:23.158] [INFO] [Godot]   - FurniturePlacementValidator: ✓
[31/01 19:22:23.158] [INFO] [Godot]   - ApartmentValueSystem: ✓
[31/01 19:22:23.158] [INFO] [Godot]   - NeighborhoodSystem: ✗
[31/01 19:22:23.158] [INFO] [Godot]   - ApartmentCustomization: ✓
[31/01 19:22:23.158] [INFO] [Godot] [TutorialManager] Timer onboarding demarre
[31/01 19:22:23.158] [INFO] [Godot] 🔄 Auto-initializing gang systems...
[31/01 19:22:23.158] [INFO] [Godot] ️ [GangSystem] In main menu - systems will initialize but NOT start
[31/01 19:22:23.158] [INFO] [Godot]   ✓ TerritorySystem
[31/01 19:22:23.158] [INFO] [Godot]   ✓ GangAI
[31/01 19:22:23.158] [INFO] [Godot]   ✓ StoreSystemManager connected to GangEconomy
[31/01 19:22:23.158] [INFO] [Godot]   ✓ WeatherSystem connected to GangEconomy
[31/01 19:22:23.158] [INFO] [Godot] ✓ GangEconomy connected - 37 businesses, 13 markets
[31/01 19:22:23.158] [INFO] [Godot]   ✓ GangEconomy
[31/01 19:22:23.158] [INFO] [Godot] ✓ PlayerBandSystem connected to other systems
[31/01 19:22:23.158] [INFO] [Godot]   ✓ PlayerBandSystem
[31/01 19:22:23.158] [INFO] [Godot] ✓ GangMemberSpawner connected - 206 spawn points generated
[31/01 19:22:23.158] [INFO] [Godot]   ✓ GangMemberSpawner
[31/01 19:22:23.158] [INFO] [Godot]   GangEventSystem ready (Weather: OK, Time: OK)
[31/01 19:22:23.158] [INFO] [Godot]   ✓ GangEventSystem
[31/01 19:22:23.158] [INFO] [Godot]   ✓ GangWarManager
[31/01 19:22:23.158] [INFO] [Godot]   GangReputationSystem ready
[31/01 19:22:23.158] [INFO] [Godot]   ✓ GangReputationSystem
[31/01 19:22:23.158] [INFO] [Godot] ContrabandMarketSystem connected to other systems
[31/01 19:22:23.158] [INFO] [Godot]   ✓ ContrabandMarketSystem
[31/01 19:22:23.158] [INFO] [Godot] AllianceSystem connected to other systems
[31/01 19:22:23.158] [INFO] [Godot]   ✓ AllianceSystem
[31/01 19:22:23.158] [INFO] [Godot]   ✓ LogSystem connected for live logs
[31/01 19:22:23.158] [INFO] [Godot]   ✓ GangSystem connected (direct)
[31/01 19:22:23.158] [INFO] [Godot]   ✓ DevMagicBook (Press O)
[31/01 19:22:23.158] [INFO] [Godot] ╔══════════════════════════════════════════════════════════════╗
[31/01 19:22:23.158] [INFO] [Godot] ║              ✓ GANG SYSTEM FULLY OPERATIONAL                 ║
[31/01 19:22:23.158] [INFO] [Godot] ╠══════════════════════════════════════════════════════════════╣
[31/01 19:22:23.158] [INFO] [Godot] ║  Press O     - Open Dev Console                              ║
[31/01 19:22:23.158] [INFO] [Godot] ║  Press F5    - Print full status                             ║
[31/01 19:22:23.158] [INFO] [Godot] ║  Press F6    - Force economy tick                            ║
[31/01 19:22:23.158] [INFO] [Godot] ║  Press F7    - Trigger random event                          ║
[31/01 19:22:23.158] [INFO] [Godot] ╚═══════════════════════════════════════════════════════════════
[31/01 19:22:23.158] [INFO] [Godot] 💬 [ChatboxUI] Interface créée
[31/01 19:22:23.158] [INFO] [Godot] 💬 [ChatboxManager] UI créée et ajoutée à la scène
[31/01 19:22:23.158] [INFO] [Godot] 🔊 118 boutons connectés au feedback audio
[31/01 19:22:23.158] [INFO] [Godot] 🔊 UIAudioFeedback initialisé (visual=true)
[31/01 19:22:23.158] [INFO] [Godot]   ✓ WeatherSystem connected
[31/01 19:22:23.158] [INFO] [Godot]   ✓ TimeSystem connected
[31/01 19:22:23.158] [INFO] [Godot]   ✓ GameLoopManager connected
[31/01 19:22:23.158] [INFO] [Godot]   ✓ QuestSystem connected
[31/01 19:22:23.158] [INFO] [Godot]   ✓ EventSystem connected
[31/01 19:22:23.158] [INFO] [Godot]   ✓ TraitSystem connected
[31/01 19:22:23.158] [INFO] [Godot]   ✓ SkillSystem connected
[31/01 19:22:23.158] [INFO] [Godot]   ✓ Inventory connected
[31/01 19:22:23.158] [INFO] [Godot]   ✓ ReputationSystem connected
[31/01 19:22:23.158] [INFO] [Godot]   ✓ BankingSystem connected
[31/01 19:22:23.159] [INFO] [Godot]   ✓ PNJManager connected
[31/01 19:22:23.159] [INFO] [Godot]   ✓ PNJGenerator connected
[31/01 19:22:23.159] [INFO] [Godot]   ✓ CrimeSceneSystem connected
[31/01 19:22:23.159] [INFO] [Godot]   ✓ InvestigationResolver connected
[31/01 19:22:23.159] [INFO] [Godot]   ✓ CaseAssignmentSystem connected
[31/01 19:22:23.159] [INFO] [Godot]   ✓ ClueSystem connected
[31/01 19:22:23.159] [INFO] [Godot]   ✓ DossierManager connected
[31/01 19:22:23.159] [INFO] [Godot]   ✓ DamageSystem connected
[31/01 19:22:23.159] [INFO] [Godot]   ✓ WantedSystem connected
[31/01 19:22:23.159] [INFO] [Godot]   ✓ PoliceService connected
[31/01 19:22:23.159] [INFO] [Godot]   ✓ UIManager connected
[31/01 19:22:23.159] [INFO] [Godot]   ✓ FinanceManager connected
[31/01 19:22:23.159] [INFO] [Godot]   ✓ BusinessManager connected
[31/01 19:22:23.159] [INFO] [Godot]   ✓ VehicleManager connected
[31/01 19:22:23.159] [INFO] [Godot]   ✓ CareerManager connected
[31/01 19:22:23.159] [INFO] [Godot]   ✓ PlayerLifeManager connected
[31/01 19:22:23.159] [INFO] [Godot]   ✓ GangWarManager connected
[31/01 19:22:23.159] [INFO] [Godot]   ✓ GangEventSystem connected
[31/01 19:22:23.159] [INFO] [Godot]  [AutonomousWorld] Initialisation de l'univers autonome...
[31/01 19:22:23.159] [INFO] [Godot]  [AutonomousWorld] ⚠️ Signaux autonomes DÉSACTIVÉS (fix memory spike)
[31/01 19:22:23.159] [INFO] [Godot]  [AutonomousWorld] ⚠️ Tick autonome DÉSACTIVÉ (debug freeze) - GangAI gère déjà le monde
[31/01 19:22:23.159] [INFO] [Godot] 👮 [INIT] Aucun policier dans la scène au démarrage
[31/01 19:22:23.159] [INFO] [Godot] 💧 0 taches chargées
[31/01 19:22:23.159] [INFO] [Godot] ⚠️ [FREEZE DETECTED] Frame took 136ms! (expected ~16ms)
[31/01 19:22:23.159] [INFO] [Godot] 🎵 [AUTO-START] Démarrage automatique de la musique: album 1
[31/01 19:22:23.159] [INFO] [Godot] 🎵 Lecture: album 1 / HowHighInstrumental.mp3
[31/01 19:22:23.159] [INFO] [Godot] 🎵 [AUTO-START] Lecture: HowHighInstrumental.mp3
[31/01 19:22:24.670] [INFO] [Godot] !!!!!!!!!!!!!!!!!!!!!!!!!!!!!!!!!!!!!!!!!!!!!!!!!!!!!!!!!!
[31/01 19:22:24.670] [INFO] [Godot] !!! MEMORY SPIKE #1 DETECTED at 6.8s !!!
[31/01 19:22:24.670] [INFO] [Godot] !!!!!!!!!!!!!!!!!!!!!!!!!!!!!!!!!!!!!!!!!!!!!!!!!!!!!!!!!!
[31/01 19:22:24.670] [INFO] [Godot]   >>> PROCESS (Task Manager): 299 MB (delta: +299 MB) <<<
[31/01 19:22:24.670] [INFO] [Godot]   Static: 299 MB (delta: +120.6 MB)
[31/01 19:22:24.670] [INFO] [Godot]   VRAM: 440 MB
[31/01 19:22:24.670] [INFO] [Resource]   Objects: 11843 (+9571) | Nodes: 799 (+651) | Resources: 2172 (+1590)
[31/01 19:22:24.670] [INFO] [Godot] ═══ SYSTEM STATE DUMP ═══
[31/01 19:22:24.670] [INFO] [Godot] MaterialPool: cached=0, max=128, total_uses=0
[31/01 19:22:24.670] [INFO] [Shader]   shader_cache: 0 entries
[31/01 19:22:24.670] [INFO] [Godot] ModelPool: available=5, in_use=0, total=5
[31/01 19:22:24.670] [INFO] [Godot] AnimPlayerPool: available=10, in_use=0, anims=15
[31/01 19:22:24.670] [INFO] [Godot] PNJManager: active_pnjs=0
[31/01 19:22:24.670] [INFO] [Godot] PNJCache: entries=0
[31/01 19:22:24.670] [INFO] [Godot] BloodEffects: decals=0, floor=0, by_id=0
[31/01 19:22:24.670] [INFO] [Godot] CorpseSystem: active=0
[31/01 19:22:24.670] [INFO] [Resource] ResourceCache: scenes=0, textures=1, materials=0, models=0
[31/01 19:22:24.670] [INFO] [Godot] CardTextureLoader: textures=0
[31/01 19:22:24.670] [INFO] [Godot] DroppedItemsManager: scene_items=0, live_items=0
[31/01 19:22:24.670] [INFO] [Godot] CitizenDatabase: citizens=0, vip_index=0
[31/01 19:22:24.670] [INFO] [Shader] CharacterCustomizer: mat=0, tex=0, combined=0, shader=0, base=0, pnj_mat=0, pnj_shader=0, converted=0, lru=0
[31/01 19:22:24.670] [INFO] [Godot] UIAudioFeedback: connected_buttons=118
[31/01 19:22:24.670] [INFO] [Godot] MapOverlaySystem: open=false, city_instance=no
[31/01 19:22:24.670] [INFO] [Godot] StainSystem: stains=?
[31/01 19:22:24.670] [ERROR] [Godot] LogSystem: buffer=25, json_entries=325, error_dedup=0
[31/01 19:22:24.670] [INFO] [Resource] Current scene: res://systems/scenes/locations/MainMenu.tscn
[31/01 19:22:24.670] [INFO] [Godot] Scene children: 12
[31/01 19:22:24.670] [INFO] [Godot] --- TOP NODE TYPES ---
[31/01 19:22:24.670] [INFO] [Godot]   Node: 161
[31/01 19:22:24.670] [INFO] [Godot]   Label: 143
[31/01 19:22:24.670] [INFO] [Godot]   Button: 118
[31/01 19:22:24.670] [INFO] [Godot]   VBoxContainer: 62
[31/01 19:22:24.670] [INFO] [Godot]   PanelContainer: 42
[31/01 19:22:24.670] [INFO] [Godot]   HBoxContainer: 41
[31/01 19:22:24.670] [INFO] [Godot]   Timer: 36
[31/01 19:22:24.670] [INFO] [Godot]   AudioStreamPlayer: 31
[31/01 19:22:24.670] [INFO] [Godot]   MarginContainer: 19
[31/01 19:22:24.670] [INFO] [Godot]   CanvasLayer: 17
[31/01 19:22:24.670] [INFO] [Godot]   Control: 16
[31/01 19:22:24.670] [INFO] [Godot]   HSeparator: 13
[31/01 19:22:24.670] [INFO] [Godot]   RichTextLabel: 10
[31/01 19:22:24.670] [INFO] [Godot]   AudioStreamPlayer3D: 8
[31/01 19:22:24.670] [INFO] [Godot]   GridContainer: 8
[31/01 19:22:24.670] [INFO] [Godot] Orphan nodes: 1474
[31/01 19:22:24.670] [INFO] [Godot] VRAM: textures=426 MB, buffers=14 MB, TOTAL=440 MB
[31/01 19:22:24.670] [INFO] [Godot] >>> PROCESS REAL (Task Manager): 0 MB <<<
[31/01 19:22:24.670] [INFO] [Godot] OS Static (Godot only): current=299 MB, peak=307 MB
[31/01 19:22:24.670] [INFO] [Godot] HIDDEN MEMORY (Vulkan/driver): -299 MB
[31/01 19:22:24.670] [INFO] [Godot] FPS: 17
[31/01 19:22:24.671] [INFO] [Godot] Process time: 36.2 ms
[31/01 19:22:24.671] [INFO] [Physics] Physics time: 0.1 ms
[31/01 19:22:24.671] [INFO] [Godot] --- ACTIVE TIMERS (23) ---
[31/01 19:22:24.671] [INFO] [Godot]   /root/MemoryDebugMonitor/@Timer@2 (wait=1.0s, left=1.0s, oneshot=false)
[31/01 19:22:24.671] [INFO] [Godot]   /root/LogSystem/@Timer@4 (wait=1.0s, left=0.0s, oneshot=false)
[31/01 19:22:24.671] [INFO] [Godot]   /root/LogSystem/@Timer@5 (wait=300.0s, left=299.0s, oneshot=false)
[31/01 19:22:24.671] [INFO] [Godot]   /root/LogSystem/@Timer@6 (wait=0.5s, left=0.0s, oneshot=false)
[31/01 19:22:24.671] [INFO] [Godot]   /root/TimeSystem/@Timer@24 (wait=1.0s, left=0.0s, oneshot=false)
[31/01 19:22:24.671] [INFO] [Godot]   /root/SkillSystem/@Timer@25 (wait=0.1s, left=0.0s, oneshot=false)
[31/01 19:22:24.671] [INFO] [Godot]   /root/ApartmentStateManager/@Timer@89 (wait=30.0s, left=29.0s, oneshot=false)
[31/01 19:22:24.671] [INFO] [Godot]   /root/FloorStateManager/@Timer@90 (wait=60.0s, left=59.0s, oneshot=false)
[31/01 19:22:24.671] [INFO] [Godot]   /root/ApartmentValueSystem/@Timer@91 (wait=86400.0s, left=86399.0s, oneshot=false)
[31/01 19:22:24.671] [INFO] [Godot]   /root/TutorialManager/@Timer@93 (wait=10.0s, left=9.0s, oneshot=false)
[31/01 19:22:24.671] [INFO] [Godot]   /root/TutorialManager/@Timer@187 (wait=1.0s, left=0.0s, oneshot=false)
[31/01 19:22:24.671] [INFO] [Godot]   /root/WeatherSystem/@Timer@94 (wait=718.1s, left=717.1s, oneshot=true)
[31/01 19:22:24.671] [INFO] [Godot]   /root/WeatherSystem/@Timer@96 (wait=1.0s, left=0.0s, oneshot=false)
[31/01 19:22:24.671] [INFO] [Godot]   /root/DealerSystem/HeatDecayTimer (wait=60.0s, left=59.0s, oneshot=false)
[31/01 19:22:24.671] [INFO] [Godot]   /root/HeistSystem/HeistGenerationTimer (wait=300.0s, left=299.0s, oneshot=false)
[31/01 19:22:24.671] [INFO] [Godot]   /root/JobMissionSystem/MissionGenerationTimer (wait=300.0s, left=299.0s, oneshot=false)
[31/01 19:22:24.671] [INFO] [Godot]   /root/JobMissionSystem/ExpiryCheckTimer (wait=60.0s, left=59.0s, oneshot=false)
[31/01 19:22:24.671] [INFO] [Godot]   /root/PlayerLifeManager/@Timer@143 (wait=1.0s, left=0.0s, oneshot=false)
[31/01 19:22:24.671] [INFO] [Godot]   /root/PlayerLifeManager/@Timer@144 (wait=60.0s, left=59.0s, oneshot=false)
[31/01 19:22:24.671] [INFO] [Godot]   /root/DroppedItemsManager/SceneCheckTimer (wait=0.5s, left=0.0s, oneshot=false)
[31/01 19:22:24.671] [INFO] [Godot]   /root/DroppedItemsManager/AutoSaveTimer (wait=30.0s, left=29.0s, oneshot=false)
[31/01 19:22:24.671] [INFO] [Godot]   /root/MainMenu/SlideshowTimer (wait=10.0s, left=9.0s, oneshot=false)
[31/01 19:22:24.671] [INFO] [Godot]   /root/InvestigationProgressUI/@Timer@186 (wait=1.0s, left=0.0s, oneshot=false)
[31/01 19:22:24.671] [INFO] [Godot] --- AUTOLOAD COLLECTION SIZES ---
[31/01 19:22:24.671] [INFO] [Godot]   Global.armes_enregistrees: 49 entries
[31/01 19:22:24.671] [INFO] [Godot]   LogSystem._json_entries: 325 entries
[31/01 19:22:24.671] [INFO] [Godot]   NodeGroupCache._cache: 12 entries
[31/01 19:22:24.671] [INFO] [Godot]   NodeGroupCache._invalidation_pending: 18 entries
[31/01 19:22:24.671] [INFO] [Godot]   GameStatistics.investigation_stats: 33 entries
[31/01 19:22:24.671] [INFO] [Godot]   SkillSystem.ALL_SKILLS: 12 entries
[31/01 19:22:24.671] [INFO] [Godot]   AdressesDatabase._zone_codes: 23 entries
[31/01 19:22:24.671] [INFO] [Godot]   CharacterCustomizer.PRELOADED_TEXTURES: 82 entries
[31/01 19:22:24.671] [INFO] [Godot]   UIAudioFeedback.connected_buttons: 118 entries
[31/01 19:22:24.671] [INFO] [Godot]   BuildingSystemManager.buildings: 157 entries
[31/01 19:22:24.671] [INFO] [Godot]   FurnitureCatalog._catalog: 59 entries
[31/01 19:22:24.671] [INFO] [Godot]   AchievementSystem.stats: 14 entries
[31/01 19:22:24.671] [INFO] [Godot]   AccessibilityManager.settings: 26 entries
[31/01 19:22:24.671] [INFO] [Godot]   DealerSystem.drug_base_prices: 29 entries
[31/01 19:22:24.671] [INFO] [Godot]   CareerManager.career_stats: 17 entries
[31/01 19:22:24.671] [INFO] [Godot]   PlayerLifeManager.player_profile: 21 entries
[31/01 19:22:24.671] [INFO] [Godot]   BloodEffects._decal_pool: 20 entries
[31/01 19:22:24.671] [INFO] [Godot]   DrawingSettings.available_colors: 12 entries
[31/01 19:22:24.671] [INFO] [Godot]   CodenamesSettings.settings: 12 entries
[31/01 19:22:24.671] [INFO] [Godot]   CardSoundManager._loaded_sounds: 28 entries
[31/01 19:22:24.671] [INFO] [Godot]   CardSoundManager._audio_players: 12 entries
[31/01 19:22:24.671] [INFO] [Godot]   StrategicRouteSystem.nodes: 13 entries
[31/01 19:22:24.671] [INFO] [Godot]   StrategicRouteSystem.district_centers: 13 entries
[31/01 19:22:24.671] [INFO] [Godot] --- HIGH SIGNAL CONNECTION COUNTS ---
[31/01 19:22:24.671] [INFO] [Godot]   Global.save_loaded: 7 connections
[31/01 19:22:24.671] [INFO] [Godot]   TimeSystem.hour_changed: 9 connections
[31/01 19:22:24.672] [INFO] [Godot]   TimeSystem.day_changed: 10 connections
[31/01 19:22:24.672] [INFO] [Godot]   MultiplayerManager.player_connected: 14 connections
[31/01 19:22:24.672] [INFO] [Godot]   MultiplayerManager.player_disconnected: 11 connections
[31/01 19:22:24.672] [INFO] [Godot] Draw calls: 18
[31/01 19:22:24.672] [INFO] [Godot] Objects drawn: 158
[31/01 19:22:24.672] [INFO] [Godot] --- HISTORIQUE 10 dernières secondes ---
[31/01 19:22:24.672] [INFO] [Godot]   t=6.8s | PROCESS: 299 MB (+299) | Static: 299 MB (+120.6) | VRAM: 440 MB | Obj: 11843 (+9571) | Nodes: 799 (+651)
[31/01 19:22:24.147] [INFO] [Godot] 📋 Nouvelle mission: Petit boulot
[31/01 19:22:24.147] [INFO] [Godot] 📋 Nouvelle mission: Collecte
[31/01 19:22:24.147] [INFO] [Godot] === JOB MISSION SYSTEM INITIALIZED ===
[31/01 19:22:26.628] [INFO] [Godot] [MenuPrincipal] QUITTER cliqué!
[31/01 19:22:26.343] [INFO] [LogSystem] === FIN DE SESSION (via MenuPrincipal) ===

╔══════════════════════════════════════════════════════════════════════════════╗
║ FIN DE SESSION                                                               ║
╠══════════════════════════════════════════════════════════════════════════════╣
║ Terminé le: 2026-01-31 19:22:26                                             ║
║ Durée: 8s                                                                   ║
║ Total logs: 439                                                             ║
║ Erreurs: 1 | Warnings: 0                                                    ║
╚═══════════════════════════════════════════════════════════════════════════════
